{
  "$schema": "../command-template.schema.json",
  "id": "docker",
  "capability": "container-runtime",
  "description": "Docker 1.13以降（State列が無い20.10未満はStatusから状態を推定）。Podは非対応。レジストリのTLS検証の無効化はコマンドではできないため daemon.json の insecure-registries で設定する。検証: Docker 29.1 (Ubuntu 24.04)",
  "executable": "docker",
  "match": { "tool": "docker", "osIds": ["*"], "minToolVersion": "1.13" },
  "commands": {
    "listContainers": { "args": ["ps", "-a", "--no-trunc", "--format", "{{json .}}"], "parser": "docker-containers-jsonl" },
    "startContainer": { "args": ["start", "{id}"] },
    "stopContainer": { "args": ["stop", "{id}"], "timeoutSeconds": 120 },
    "restartContainer": { "args": ["restart", "{id}"], "timeoutSeconds": 120 },
    "removeContainer": { "args": ["rm", "{id}"] },
    "containerLogs": { "args": ["logs", "--tail", "{tail}", "{id}"] },
    "listImages": { "args": ["images", "--no-trunc", "--format", "{{json .}}"], "parser": "docker-images-jsonl" },
    "pullImage": { "args": ["pull", "{image}"], "timeoutSeconds": 1800 },
    "tagImage": { "args": ["tag", "{image}", "{target}"] },
    "pushImage": { "args": ["push", "{image}"], "timeoutSeconds": 1800 },
    "removeImage": { "args": ["rmi", "{id}"] },
    "loadImage": { "args": ["load", "-i", "{file}"], "timeoutSeconds": 1800 },
    "registryLogin": { "args": ["login", "--username", "{username}", "--password-stdin", "{registry}"], "timeoutSeconds": 60 },
    "registryLogout": { "args": ["logout", "{registry}"] },
    "imageExists": { "args": ["image", "inspect", "--format", "{{.Id}}", "{image}"] },
    "renameContainer": { "args": ["rename", "{id}", "{name}"] },
    "containerRestartCount": { "args": ["inspect", "--format", "{{.RestartCount}}", "{id}"] },
    "runContainer": {
      "args": ["run", "-d", "--name", "{name}", "--label=io.systemagent.deployment={name}", "--restart={restart}",
               "--publish={*ports}", "--env={*env}", "--volume={*volumes}", "{image}"],
      "timeoutSeconds": 300
    }
  }
}
