{
  "$schema": "../command-template.schema.json",
  "id": "podman",
  "capability": "container-runtime",
  "description": "Podman 3.0以降（RHEL 8/9、AlmaLinux/Rocky 8/9、Ubuntu 22.04以降 等）。検証: Podman 5.8 (AlmaLinux 9)、4.9 (Ubuntu 24.04)",
  "executable": "podman",
  "match": { "tool": "podman", "osIds": ["*"], "minToolVersion": "3.0" },
  "commands": {
    "listContainers": { "args": ["ps", "-a", "--pod", "--format", "json"], "parser": "podman-containers-json" },
    "startContainer": { "args": ["start", "{id}"] },
    "stopContainer": { "args": ["stop", "{id}"], "timeoutSeconds": 120 },
    "restartContainer": { "args": ["restart", "{id}"], "timeoutSeconds": 120 },
    "removeContainer": { "args": ["rm", "{id}"] },
    "containerLogs": { "args": ["logs", "--tail", "{tail}", "{id}"] },
    "listImages": { "args": ["images", "--format", "json"], "parser": "podman-images-json" },
    "pullImage": { "args": ["pull", "--tls-verify={tlsVerify}", "{image}"], "timeoutSeconds": 1800 },
    "tagImage": { "args": ["tag", "{image}", "{target}"] },
    "pushImage": { "args": ["push", "--tls-verify={tlsVerify}", "{image}"], "timeoutSeconds": 1800 },
    "removeImage": { "args": ["rmi", "{id}"] },
    "loadImage": { "args": ["load", "-i", "{file}"], "timeoutSeconds": 1800 },
    "registryLogin": { "args": ["login", "--tls-verify={tlsVerify}", "--username", "{username}", "--password-stdin", "{registry}"], "timeoutSeconds": 60 },
    "registryLogout": { "args": ["logout", "{registry}"] },
    "imageExists": { "args": ["image", "exists", "{image}"] },
    "renameContainer": { "args": ["rename", "{id}", "{name}"] },
    "containerRestartCount": { "args": ["inspect", "--format", "{{.RestartCount}}", "{id}"] },
    "runContainer": {
      "args": ["run", "-d", "--name", "{name}", "--label=io.systemagent.deployment={name}", "--restart={restart}",
               "--pod={*pod}", "--publish={*ports}", "--env={*env}", "--volume={*volumes}", "{image}"],
      "timeoutSeconds": 300
    },
    "listPods": { "args": ["pod", "ps", "--format", "json"], "parser": "podman-pods-json" }
  }
}
